start	end	text
1280000	1283000	Let them know that you don't agree. Make them listen to a different perspective.
1283000	1287000	And if you're someone who's gotten involved with the alt-right in the last couple years
1287000	1291000	and is now disillusioned to find yourself in the midst of a dangerous hate group,
1291000	1293000	you have to get out now.
1293000	1296000	It's not too late, society will forgive you.
1296000	1299000	If you don't know how to leave, look up Life After Hate,
1299000	1303000	an organization founded by a former neo-Nazi that helps people get out of hate groups.
1303000	1306000	And as for all you lefties, naz drovia.
1306000	1308000	Keep up the good fight, comrades.
1363000	1365000	Thanks for watching.
1393000	1395000	Thanks for watching.
