start	end	text
1302000	1306000	There are gender non-conforming men who present very femme but use male pronouns.
1306000	1310000	There are cis men who use female pronouns whenever they present female.
1310000	1312000	There are gender-fluid people who use different pronouns
1312000	1314000	depending on their current presentation.
1314000	1317000	There are pre-transition trans people who identify as a gender
1317000	1320000	other than the one they present and live as and prefer other pronouns.
1320000	1323000	So you really can't just rely on the way a person looks
1323000	1327000	because there's a lot of situations where the way they look doesn't tell you the whole story.
1327000	1331000	So, as you can see, identity definitely is important,
1331000	1334000	but it's also not the only thing that matters.
1334000	1337000	If psychological identity were the only thing that mattered,
1337000	1341000	then there would be no need for a trans person to come out or do anything to transition,
1341000	1343000	including requesting different pronouns,
1343000	1346000	because pronouns belong to the social world of language.
1346000	1348000	Not to individual psychology.
1348000	1352000	This is an idea I tried to explore in my sexy furry video.
1352000	1354000	You can identify however you like,
1354000	1357000	but gender is also social, structural, and interpersonal.
1357000	1361000	So if, for example, you're a trans woman still living as a man,
1361000	1365000	then you are fully trans, your identity is fully valid,
1365000	1367000	but until you begin living as a woman,
1367000	1370000	your womanhood remains kind of hypothetical.
1370000	1373000	And when I say living as a woman, I don't mean passing.
1373000	1376000	There's too much emphasis on physical appearance,
1376000	1378000	and not enough on social relationships.
1378000	1381000	You know, you don't become a woman the first time you put on a dress.
1381000	1385000	You become a woman the first time an older female relative turns to you at a restaurant
1385000	1387000	and says, maybe you should order the salad, sweetie.
1387000	1390000	My point is not to invalidate anyone's identity.
1390000	1393000	As far as I'm concerned, if a trans person hasn't transitioned yet,
1393000	1395000	they are fully trans.
1395000	1399000	I'm just trying to be realistic about the fact that a lot of people's gendered experience
1399000	1402000	isn't entirely a product of how they identify.
1402000	1405000	To put it this way, I will always use female pronouns for a trans woman,
1405000	1408000	but my thought process behind it isn't always the same.
1408000	1411000	Many trans women just seem like women to me
1411000	1414000	in literally the same way that cis women seem like women,
1414000	1418000	and I use female pronouns for them effortlessly just as I was trained to do from birth.
1418000	1421000	This, I think, is the goal for most binary trans people.
1421000	1424000	We want not necessarily to pass perfectly,
1424000	1427000	but at least to seem like our genders to the people around us.
1427000	1429000	As Laura Jane Grace put it,
1430000	1432000	You want them to see you like they see every other girl.
1432000	1436000	I want people calling me she not out of politeness or respect for my identity.
1436000	1438000	As a trans woman.
1438000	1440000	But just because I seem like a woman to them,
1440000	1442000	because the reality is,
1442000	1446000	not all trans women seem like a woman to me in that visceral way,
1446000	1449000	and I live with this constant crushing anxiety
1449000	1451000	that I don't seem like a woman to other people.
1451000	1454000	I'm terrified of looking like a third-rate drag queen,
1454000	1457000	and I cope with that fear by looking like a second-rate drag queen.
1457000	1461000	But look, even if a person is giving my eyes and ears a zero percent woman,
1461000	1463000	if she tells me she's a trans woman,
1463000	1466000	I'm going to use female pronouns no matter what she looks like.
1466000	1468000	Not just to be polite,
1468000	1472000	but also because I want to recognize the reality of her psychological experience,
1472000	1475000	and especially because I want to help her resocialize
1475000	1478000	and reintegrate into the world as her true gender.
1478000	1482000	And of course, cis people, you legally have the freedom to refuse to do that,
1482000	1486000	but if you refuse, you are being a shit-gibbon.
1486000	1489000	And I would prefer that you not be a shit-gibbon.
1489000	1492000	Now, we need to address the genderqueer elephant in the room.
1492000	1495000	An increasing number of people identify not as male or female,
1495000	1497000	but as non-binary,
1497000	1500000	an umbrella term encompassing a bunch of more specific labels
1500000	1504000	such as genderqueer, genderfluid, agender, greygender, and so on.
1504000	1506000	Many of these people use a non-binary pronoun.
1506000	1508000	In English, usually they.
1508000	1511000	Now if your first impulse is to argue that singular they is ungrammatical nonsense,
1511000	1515000	consider that having gendered singular third-person pronouns at all
1515000	1518000	is a particular feature of the English language
1518000	1520000	that's by no means shared by all other languages,
1520000	1524000	including Turkish, Korean, and Finnish, which don't have them at all.
1524000	1526000	Language is just a bunch of fucking sounds coming out of your mouth
1526000	1528000	that humans make up to suit our purposes.
1528000	1530000	If you're new to using singular they,
1530000	1534000	it is a little confusing at first, but with some practice, it gets pretty easy.
1534000	1535000	They poured milk on me.
1535000	1537000	I poured milk on them.
1537000	1540000	They did anoint themselves in their milk and it was good, thus saith the Lord.
1540000	1543000	So the polite thing to do here is easy.
1543000	1544000	If someone asks you to call them they,
1544000	1545000	you call them they.
1545000	1546000	You call them they.
1546000	1549000	But if you're like me, you don't want to just do a thing
1549000	1552000	because you dogmatically believe it's the woke thing to do.
1552000	1554000	You want to understand why you're doing it.
1554000	1557000	I don't just want to tolerate non-binary people.
1557000	1558000	I want to be a convert.
1558000	1561000	I want to believe about them while they believe about themselves,
1561000	1563000	so long as those beliefs are reasonable.
1563000	1565000	So what do all these words mean?
1565000	1567000	What are these people talking about?
1567000	1570000	Remember earlier we distinguished gender expression from gender identity.
1570000	1574000	John McClain is feminine in expression, but a man in identity.
1574000	1578000	Whereas I am a woman in identity and in expression, I am a mess.
1578000	1582000	Let us meditate upon one of lesbian culture's great contributions to humanity,
1582000	1587000	art, science, spirituality, sexuality, metaphysics, the Futch scale.
1587000	1591000	The Futch scale is a diagram that looks like this and quantifies from 1 to 10
1591000	1595000	or high femme to stone butch the gender expression of a given domain,
1595000	1598000	such as Mulan looks or Steven universe characters.
1599000	1604000	It can also be used more abstractly for weapons, fish Pokemon, or wind instruments.
1604000	1608000	Maybe what non-binary people are trying to do with words like genderqueer, agender,
1608000	1613000	greygender, and so on is to give to identity the same kind of specificity
1613000	1615000	the Futch scale gives to expression.
1615000	1619000	But my input on this isn't really worth that much because I'm not non-binary.
1619000	1622000	And to tell you the truth, I kind of feel for cis people here
1622000	1627000	because all this talk about gender identity, a lot of the time I don't really get it either.
1627000	1631000	I look inside myself and ask, do I feel like a man or a woman?
1631000	1635000	And after all these years, the answer is still that I feel like shit.
1635000	1637000	And that's how I experience gender.
1637000	1641000	I live, I exist as a woman, which is the only way I can achieve
1641000	1644000	the same level of sadness and dysfunction as everyone else.
1644000	1646000	And I identify as trash.
1646000	1650000	I guess there are certain moments that make me feel like a natural woman.
1650000	1654000	Oh, listening to Aretha Franklin, the pain and ecstasy of penetration,
1654000	1659000	waiting in a long ass line for the restroom, a big strong arm around my waist,
1659000	1663000	being asked if I have any tampons, having tampons in case someone asks,
1663000	1666000	a dude explaining Philosophy 101 to me and me going,
1666000	1669000	oh really? Wow.
1669000	1672000	But you know these experiences mean different things to different people.
1672000	1678000	So all I can really tell you is that I prefer to express myself with diaphanous feminine gestures
1678000	1681000	that taking female hormones and having feminizing medical procedures
1681000	1686000	makes me feel more at home in my body and that I like it when other people treat me as a woman,
1686000	1688000	socially, spiritually, sexually.
1688000	1691000	So that's the jargon free explanation of my gender as I see it.
1691000	1696000	Am I really truly a woman ontologically, neurologically, metaphysically?
1696000	1699000	Well, honestly, I don't even know what that would mean.
1699000	1703000	But I do know that the life I live as a woman is the only life I have.
1703000	1706000	And that, I think, is legitimate enough.
1706000	1709000	So I know what living as a woman means to me,
1709000	1711000	but what does it mean to live a non-binary life?
1711000	1714000	Well, just like what it means to be a man or a woman,
1714000	1717000	that's something that's going to vary between individuals and cultures.
1717000	1720000	Some cultures have ancient third gender traditions,
1720000	1726000	such as the Hydra of South Asia, a legally recognized gender in India, Pakistan, Nepal, and Bangladesh,
1726000	1730000	or the various two spirit traditions of indigenous North American tribes.
1730000	1733000	Non-indigenous American culture doesn't have a third gender tradition,
1733000	1736000	but we do have individual non-binary people,
1736000	1740000	some of whom are making content that has taught me a lot about non-binary experience,
1740000	1743000	non-binary bodies, and non-binary life.
1743000	1746000	We have a lot in common, binary and non-binary trans people.
1746000	1748000	Even as a binary trans person,
1748000	1751000	I used to live as one gender and now I live as another gender.
1751000	1755000	That in itself is a pretty serious challenge to the stability of the binary.
1755000	1758000	But many of the people who call themselves non-binary
1758000	1761000	seem to be fighting for something more radical than what I'm fighting for,
1761000	1763000	at least in my personal life.
1763000	1766000	I'm just trying to assimilate into a pre-existing female gender role.
1767000	1768000	Heh.
1768000	1770000	As you can see by the normal way I'm dressed.
1770000	1772000	The traditional female garb of my culture.
1772000	1775000	Neer-neer-neer-neer-neer-neer-neer-neer-neer-neer.
1775000	1776000	No!
1776000	1780000	Whereas non-binary people are trying to cast off these roles entirely,
1780000	1784000	they're effectively trying to create the society that includes them.
1784000	1787000	And sometimes that puts me at cross-purposes with some non-binary people,
1787000	1792000	who, for example, promote the practice of always asking for someone's pronouns.
1792000	1795000	Whereas, I love it when people assume my gender,
1795000	1797000	provided they assume it correctly.
1797000	1801000	Otherwise, I will throw you an imaginary Canadian pronoun jail.
1801000	1804000	But what we all agree on is that many trans, non-binary,
1804000	1807000	and gender non-conforming people find it easier to navigate the world
1807000	1811000	using pronouns other than the ones that Ben Shapiro wants you to use.
1811000	1814000	So if you want me to call you they, I'm gonna call you they.
1814000	1817000	And though I cannot and will not force you, viewer,
1817000	1819000	to do or say anything,
1819000	1823000	I do hope you use your free will to freely choose to use your freedom of speech
1823000	1825000	to choose to do the same.
1825000	1826000	Freely.
1833000	1836000	Well, at least there was a hideous monster this time.
1836000	1839000	I'm talking about the female lead.
1840000	1842000	Now the fun really begins.
1842000	1843000	The show's over.
1843000	1846000	I'm gonna go take my tits out at a funeral parlor,
1846000	1849000	so goodbye, my satanic subscribers.
1849000	1851000	Until next week...
1852000	1854000	Go to hell!
1876000	1880000	In hell!
1882000	1884000	We'll go hell!
1884000	1886000	In hell!
1886000	1888000	In hell!
1906000	1908000	We'll go hell!
