start	end	text
1281700	1285660	expensive than purebreds that cost hundreds of dollars.
1285660	1289580	Pit bulls became popular with dog fighters for similar reasons.
1289580	1293740	While the vast majority of pit bulls weren't tossed into fighting pits, the ones that were
1293740	1298100	became prominent fixtures in press coverage, and this is where the myth of the vicious
1298100	1300500	pit bull really begins.
1300500	1304700	Stories of pit bull attacks, while not necessarily statistically higher than other breeds of
1304700	1310380	dogs, were frequently seen in newspapers, and once this reputation was created, anyone
1310380	1314220	who might need a vicious dog would be more inclined to get a pit bull and to raise it
1314220	1315540	up as such.
1315540	1320380	This created a cycle that got worse in the 1980s when the war on drugs began.
1320380	1324180	Pit bulls were increasingly associated in media narratives with drug dealers, using
1324180	1330580	them as vicious protectors and drug dealers in the 1980s in the minds of a white suburban
1330580	1334500	readership or black or hispanic.
1334500	1339460	Pit bulls, by proxy, got saddled with the racism that was targeted at their owners,
1339460	1345300	and while some dog breeds, such as Dobermans and St. Bernards, have weathered negative
1345300	1350660	public opinions after a few stories about bites, the association with drugs and some
1350660	1363020	good old-fashioned racism gave pit bulls a stigma that wouldn't fade so easily.
1363020	1367660	A recent news article uncovered some examples of how alt-right posters on 4chan are trying
1367660	1373020	to push the pit bull meme to advance their usual racist narrative, and certain enablers,
1373020	1376260	like Brittany Venti, are all too happy to help them along.
1376260	1381720	Now I don't know for sure if Brittany Venti herself is a racist, I'm not really that
1381720	1386660	familiar with her work to be honest, but she certainly is being used by them to advance
1386660	1388140	a narrative.
1388140	1393300	That makes this video deeply irresponsible and dangerously misleading.
1393300	1396420	The story of the pit bull does have an important lesson.
1396420	1401100	Genes are undoubtedly a part of our behavior, but social influences like breeding pressure
1401100	1404420	don't create meaningful lasting changes.
1404420	1408580	All animals are a product of their environment and how their genes interact with it.
1408580	1413540	So instead of treating a dog like a public menace, treat them with love and compassion.
1413540	1417700	And don't let dog discrimination be your gateway into thinking that people who don't look like
1417700	1419620	you are genetically inferior.
