start	end	text
1297440	1300800	I'm going to read this revealing passage for you now.
1300800	1305700	This is a conversation the whale has with Jensen after he decides to murder Kemp.
1305700	1308980	Kemp is listening to this conversation from inside the stomach.
1308980	1314780	Jensen swallows, I can hear it all the way across the room, not even through the beacon.
1314780	1319860	Sir, he says, that would be pure murder.
1319860	1326500	Yes, says the whale, but it's my body, and what's in it is my purview.
1326500	1327500	That's the law.
1327500	1332220	Look it up, but look it up after you call the doctor.
1332220	1335260	This story is about abortion.
1335260	1338700	Yeah, that basically gives it all away, huh?
1338700	1344260	So now do we talk about how a living being grows inside a person, or there's a caesarean
1344260	1350120	operation, or a doctor is being called upon to be complicit in murder?
1350120	1355460	Sometimes a story's narrative is so bad, so clumsy, and falls so hard on its face that
1355460	1360740	the only fitting criticism is to tell everybody what happens in it.
1360740	1363860	So let's move on to the next story.
1363860	1368860	Utopia is the shortest of the three stories, and easily the worst one, mostly because it's
1368860	1374180	not really a story, just a drab portrait of what Ben believes a socialist utopia would
1374180	1375420	look like.
1375420	1380600	One where everyone lives the same life, with every part of it decided for them by the government.
1380600	1386100	Our hero is a nameless protagonist who lives in this sheltered society trapped in a giant
1386100	1388500	bubble cut off from the rest of the world.
1388500	1393340	He goes about his drab life working at some random factory where his job is turning to
1393340	1395180	spigot on and off.
1395180	1400220	On Wednesdays he plays cards with some strangers, Tuesdays he hooks up with a random woman,
1400220	1403340	and on Thursdays he goes out and looks at the stars.
1403340	1408540	Ben gives us a world where there are no relationships, not romantic ones, and not even friendships.
1408540	1413020	This socialist utopia means giving up all those things as people come and go out of
1413020	1416060	your life and no meaningful connection is ever made.
1416060	1422180	On one of his stargazing nights, our protagonist looks up at the sky and notices a comet streaking
1422180	1423180	through the night.
1423180	1427540	It happens to be Haley's comet, which passes by every 75 years, although this only gets
1427540	1429420	revealed a little bit later on.
1429420	1433900	Somehow, seeing this comet awaken something in our protagonist.
1433900	1435660	Here's how the book describes it.
1435660	1439420	And suddenly, his hazy dream burst into consciousness.
1439420	1444700	He found himself standing, tears rolling down his face, gazing up at the sky, a terrible
1444700	1450740	longing filled him, a feeling of dread and of hope, a new feeling, an old feeling.
1450740	1454820	The star tore the night apart, leaving day falling behind it.
1454820	1459780	When he looked around him, he saw thousands of eyes and thousands of faces staring at
1459780	1461780	him, blankly.
1461780	1463940	The star hit the horizon.
1463940	1466700	He turned and ran.
1466700	1469060	Every line is so breathless in Ben's writing.
1469060	1473980	It's like he imagines every story to be utterly captivating and demands the reader being thralled
1473980	1475500	along with him.
1475500	1481580	This reader was annoyed by the tiny sentences that never offered anything of depth or value.
1481580	1487260	There are just these tiny little descriptions of plot points, only filled with the barest,
1487260	1491740	scantest of details that seem completely perfunctory.
1491740	1494020	And what exactly is happening in this moment?
1494020	1497660	A transformation, yes, but how and why?
1497660	1500700	And what exactly is changing here?
1500700	1503420	Let's see if the story will answer that for us.
1503420	1507700	The protagonist's dash is immediately noticed by the Ministry of Protection.
1507700	1511660	There are a lot of ministries in this book, but this is the only one that actually does
1511660	1512660	anything.
1512660	1515820	Several enforcers are dispatched to chase after the protagonist.
1515820	1520580	They try using this thing called the pulse, which is some kind of weapon that uses sound
1520580	1522220	to incapacitate people.
1522220	1525940	When they try using it on our protagonist, this happens.
1525940	1528220	Behind him, the pulse crescendoed.
1528220	1533140	He could feel the hair on his arm stand on end, his knees begin to buckle.
1533140	1538700	Soon, he knew, his legs would give out, his head fry from the pulse.
1538700	1543620	Yes, his head fry from the pulse, good copy editing there, by the way.
1543620	1545120	But it didn't.
1545120	1548800	The enforcer's eyes widened in shock as the pod approached.
1548800	1554300	He was well within range of the pulse now, yet nothing was happening, nothing.
1554300	1559140	Another enforcement pod opened up with the pulse, full bore, nothing.
1559140	1561420	A smile creased his worn face.
1561420	1564140	He slowed to a jog, then a walk.
1564140	1569420	Then, finally, he stopped dead and turned around, facing his pursuers.
1569420	1575260	As he did, the pods backed away, as though called away by some higher power.
1575260	1577980	He turned again and ran toward the mountain.
1577980	1583980	I have no idea why this pulse, which we've not heard about until now, doesn't work.
1583980	1585180	It just doesn't.
1585180	1587360	And this is never explained in the story.
1587360	1590740	And this mountain location is mentioned for the first time right here.
1590740	1595340	I don't know why the protagonist knows to just run towards it, but that's what's happening.
1595340	1599300	What's even funnier is that Ben doesn't even know how his protagonist knows about
1599300	1600300	the mountain.
1600300	1602780	He didn't know how he knew about the mountain.
1602780	1605440	The Ministry of Environment never talked about it.
1605440	1609060	Nobody knew the words mountain or valley.
1609060	1612940	He couldn't even see the mountain thanks to the bubble, the protective climate change,
1612940	1620020	the artificial environment that made all land even and flat, fruitful and evenly graded.
1620020	1622980	Nobody he knew had ever been outside the bubble.
1622980	1627220	The protagonist runs towards the mountain, but is stopped by the dome of his enclosure.
1627220	1631540	Eventually, for unnamed reasons, the doorway is opened and the protagonist is allowed to
1631540	1632880	approach the mountain.
1632880	1638020	As he approaches, the protagonist sees a sign that reads, The Creed of Ignorance.
1638020	1642100	This for the unfamiliar is how Winston Churchill referred to socialism.
1642100	1647580	The full quote reads, socialism is the philosophy of failure, the creed of ignorance and the
1647580	1649420	gospel of envy.
1649420	1653540	Why would socialists put up part of a quote that makes them sound like the bad guys?
1653540	1656100	And that quote basically encapsulates this story.
1656100	1659420	People living in this socialist utopia all think they're happy, but they're actually
1659420	1664260	under a mass delusion that our nameless protagonist has broken out of, somehow.
1664260	1666180	Let's read on and see if we get an answer to that.
1666180	1668180	He probably guessed we aren't though, right?
1668180	1670020	Yeah, he probably figured that out.
1670020	1674020	A chamber inside the mountain houses an old man and his many books.
1674020	1678220	He's bedridden and just kind of lame there when our protagonist finds him, and the two
1678220	1680260	have a weighty conversation.
1680260	1683940	Here's the closest we get to understanding what sent our protagonist on his journey.
1683940	1684940	Halley's Comet.
1684940	1687980	I know you don't know what that is, never mind about that.
1687980	1691340	Suffice it to say that it shows up once every 75 years.
1691340	1694980	Your father and mother must have seen it at some point.
1694980	1696700	At that he spoke.
1696700	1699140	I never knew my father and mother.
1699140	1701140	But you remember the comment.
1701140	1703820	I don't know what I remember.
1703820	1705240	And then they move on.
1705240	1711540	If you want answers to nonsensical plot twists, or in this case, the entire premise, Ben Shapiro
1711540	1713260	isn't the writer for you.
1713260	1717620	But maybe I'm being nitpicky, it might not matter what brought us to this point.
1717620	1722120	We have a social outcast from a socialist society who's confronting a man revealed
1722120	1724480	to be one of that society's architects.
1724480	1729020	This is the moment this was all building to, so maybe it'll pay off and of course it's
1729020	1731720	not going to pay off, but let's find out what happens.
1731720	1736200	In the minds of the socialist, according to the story, the problem is diversity.
1736200	1739740	The differences between people create strife and discord.
1739740	1741460	Let's let the old man explain it.
1741460	1747100	For no matter what measures government tried, inequality remained, redistribution of resources
1747100	1748860	merely masked the problem.
1748860	1754580	Laws directed toward helping particular groups often ended with them being strangely disadvantaged.
1754580	1757900	Different abilities bred different values, different belief systems.
1757900	1760820	Those values and systems caused conflict.
1760820	1762800	We tried everything to solve it.
1762800	1764180	We tried education.
1764180	1768460	We tried genetic treatments designed to raise the average intelligence.
1768460	1772100	But each IQ point meant a massive difference in outcome.
1772100	1774340	There's something very sinister happening here.
1774340	1777180	And I don't just mean the swipe at the welfare state.
1777180	1781860	What Ben is presenting to us is a reading of diversity amongst cultures as the product
1781860	1783660	of genetic differences.
1783660	1787740	That is to say, the reason some societies differ from others, and more importantly,
1787740	1793000	why some societies perform better than others, is because of their genes.
1793000	1799500	This story is resting very heavily on the idea that some people, or in this case, some
1799500	1804020	groups of people, are simply born better than others.
1804020	1810220	And he pulls it out to mean that this is a product of our genes, and is completely inescapable,
1810220	1812220	regardless of how we engineer society.
1812220	1817180	It completely disregards history, environments, both physical and social.
1817180	1822540	If some cultures do better than others, ultimately, it can only be explained because their people
1822540	1824740	are genetically superior.
1824740	1828460	If we don't want to talk about culture, we can also talk about class.
1828460	1833300	Rich people are rich because they have superior genes compared to poor people.
1833300	1835860	They were simply born to be better.
1835860	1840220	In this story, because the old man specifically refers to breeding programs that needed to
1840220	1846300	be used to filter out the differences between people, it's literally talking about eugenics.
1846300	1850500	The line towards race realism here is pretty direct.
1850500	1854740	For those who don't know, race realism is a pseudoscience that tries to justify racism
1854740	1859940	through a misunderstanding of genetics and overemphasis on arbitrary physical characteristics.
1859940	1864340	I don't want to get too sidetracked here, but if you want to know why this is nonsense,
1864340	1867460	I've included a few links in the description below.
1867460	1872560	It's all nonsense, and it's used to explain away some of history's worst crimes.
1872560	1876020	The old man describes his ideals.
1876020	1877900	Equality is the key.
1877900	1879840	Equality cannot be achieved in excellence.
1879840	1882900	It can only be achieved in mediocrity.
1882900	1885700	And we have achieved it within the bubble.
1885700	1886900	All are equal.
1886900	1887900	All want nothing.
1887900	1888900	Aspire to nothing.
1888900	1889900	It is perfect.
1889900	1891540	It is stasis.
1891540	1893100	It took generations.
1893100	1896460	Three generations to breed out the intelligent, to select out the unique.
1896460	1900020	We have more disease now, but we have no unhappiness.
1900020	1903420	More poverty now, but shared by all.
1903420	1907500	This operation to create equality didn't take with our protagonist, though.
1907500	1912260	When the old man tells him happiness is a myth, then nothing can make man happy because
1912260	1917260	of our internal desires to do better, and eventually failing, becoming unhappy, the
1917260	1921500	protagonist responds, no, he said.
1921500	1924460	It is happiness to be so unhappy.
1924460	1929420	What he's saying so clumsily is the pursuit of greatness, even if it falls short, is what
1929420	1930780	makes people happy.
1930780	1934100	Maybe because we fall short and always have something to strive towards.
1934100	1938620	Although I'm putting words in his mouth a little here, especially with that last sentence.
1938620	1942700	Because instead of getting more detail, but what I suspect is the whole point of the story,
1942700	1945260	we get a cringy action scene instead.
1945260	1949180	Two enforcers have showed up to the mountain to take our protagonist away.
1949180	1954740	The old man has decided an independent man like our protagonist is trouble.
1954740	1957140	Here's one really bad part.
1957140	1960220	It's describing the actions of our protagonist in this scene.
1960220	1963540	He leapt to the bookcase, his hand gripped a volume.
1963540	1968060	The penta took, it said, and he pulled it from the bookcase.
1968060	1970160	The withered man was screaming now.
1970160	1972480	In anger or despair, he could not tell.
1972480	1977060	He swung the heavy volume, metal edged at the other enforcer, who was moving towards
1977060	1979540	him with a slow certitude.
1979540	1984740	The book crunched into the enforcer's skull, and he toppled to the floor with a crash.
1984740	1989700	For the unfamiliar, the penta took are the first five books on the Old Testament.
1989700	1995460	Yeah, this story literally has someone being beaten to death with a holy book.
1995460	1998620	Subtle, this story is not.
1998620	2002740	The protagonist confronts the old man, accusing him of ruining mankind's potential, and then
2002740	2005540	he uses a pillow to smother the old man's scene.
2005540	2008020	You protected us from our humanity.
2008020	2012580	From our possibility, may God, the word jumped again to his mouth.
2012580	2014860	May God forgive you.
2014860	2019380	In one fell swoop, our protagonist has found God and killed his oppressor.
2019380	2023260	And the story ends with him wandering off into the wilderness to see if there are other
2023260	2026340	painfully contrived morality tales he can appear in.
2026340	2030780	One of the biggest problems this story has is that there's no internal logic to the
2030780	2031780	plot.
2031780	2034180	The main character realizes something somehow.
2034180	2038340	He is pursued until he isn't, and then he is again.
2038340	2041260	And he knows about places before knowing about them.
2041260	2045140	That last part in particular is a problem, since so much of this story is dedicated to
2045140	2047300	describing the main character's ignorance.
2047300	2050620	He doesn't know what ants are, he's never seen books, he doesn't know what mountains
2050620	2055980	are, he doesn't know what a comet is, but he knows the mountain when he needs to, and
2055980	2059740	he knows anything he needs to know when the plot requires him to.
2059740	2065740	When he realizes that his life is unfulfilling and makes him unhappy, the story is trying
2065740	2070780	to convey this inner truth as if the knowledge of wanting more out of life is some kind of
2070780	2074060	natural impulse that can't be extinguished, only hidden.
2074060	2078700	It's not a terrible point, but the problem is here, in the story of free will and not
2078700	2083340	having life dictated to you by the government, ironically makes its protagonist seem like
2083340	2087100	a marionette dancing on its author's strings.
2087100	2093580	How can this be a story of free will and self-determination when it's so painfully contrived and forced?
2093580	2097980	This is how terrible writing can ultimately undermine any point an author is trying to
2097980	2098980	make.
2098980	2103460	The worldview here is ultimately one built on selfishness and tribalism.
2103460	2108260	It not only seems to be fine with one group of people having a higher concentration of
2108260	2113580	wealth to the detriment of others, it also says that they are inherently worthy of that
2113580	2115500	higher position in society.
2115500	2121180	Think back to the talk about diversity creating strife because some groups have superior genes.
2121180	2123860	This is presented as the natural order.
2123860	2127620	In this story's world, socialists are trying to upset a natural order where the superior
2127620	2131420	people make more money and the inferior ones live in squalor.
2131420	2136060	It's a full-throated defense of capitalism, using racist pseudoscience as an excuse for
2136060	2138580	not having to care about the poor.
2138580	2141060	And it's a pretty terrible short story too.
2141060	2146220	Part of me wants to look back and have some sort of grand conclusion now that I've read
2146220	2152420	the complete works of Ben Shapiro's fiction, but a bigger part of me would like to simply
2152420	2156500	fade away and never think about this dark period in my life.
2156500	2161500	Although if he publishes another book, I will definitely, definitely be reading it.
2161500	2164700	Not buying it, but definitely reading it.
2164700	2165700	Whew.
2165700	2170740	So yeah, another Ben Shapiro literature adventure for all of you.
2170740	2176940	For those wondering, I did not purchase this short story collection and I very much recommend
2176940	2179300	against doing that.
2179300	2182740	It's very bad and you would be giving a bad man money.
2182740	2183740	Don't do it.
2183740	2187420	Not all of my videos are going to be about terrible, conservative fiction in the future.
2187420	2191540	I might do a few now and then if anything catches my eye.
2191540	2197860	The names you see on the screen are my lovely, lovely, lovely, lovely patrons.
2197860	2202220	If you've enjoyed my videos, please consider making a monthly donation if it's within
2202220	2203220	your memes.
2203220	2205220	It really does help a lot.
2205220	2211180	I know these videos don't look like it, but they do actually cost time and money to produce.
2211180	2216140	So anyone who would like to contribute to helping me make more videos, I very much
2216140	2217380	am grateful for that support.
2217380	2223100	A special shout out to my patron who decided to donate $5.69.
2223100	2224540	Hell yeah.
2224540	2226880	That's the sex number.
2226880	2233020	If you enjoy this video or this channel, definitely like, comment, and subscribe.
2233020	2234780	Also hit the little bell to get reminders.
2234780	2238900	You can follow me on Twitter, ask me a question on Curious Cat.
2238900	2239900	Thank you.
2239900	2241500	Thank you so much for watching.
