start	end	text
0	8560	Oh god, this one is even worse.
8560	14960	When we last met, I was wading through the sewage of Ben Shapiro's 2016 novel, True
14960	15960	Allegiance.
15960	22080	In that video, I mentioned an earlier book in the Ben Shapiro-Ura, a collection of short
22080	29400	stories from 2015 titled What's Fair and Other Short Stories, released on Amazon.com
29400	30680	as an e-book.
30680	35960	This title seems to be less popular than Ben Shapiro's 2016 novel, based on its limited
35960	38280	release and lower review count.
38280	44060	It bills itself as a collection of short stories, but there are only three, which I guess meets
44060	46300	the technical definition of a collection.
46300	49520	But it makes for a far shorter read than I expected.
49520	51960	Ben's stories cover three genres.
51960	56840	There's Americana, sci-fi, and a 16-year-old's LiveJournal page.
56840	60960	But to truly see the man at his craft, we'll have to dive right in.
60960	62460	Let's go.
62460	67280	The titular story in this little tome is What's Fair.
67280	72860	In true Ben Shapiro fashion, this story feels like someone trying to cram a bad novel into
72860	78040	a few pages and reducing it to a series of basic plot points, all fired off at a rapid
78040	79200	pace.
79200	83120	This story is told through the eyes of Tommy, who relates his long and troubled history
83120	84960	with his older brother Jim.
84960	89260	The two grew up on a farm in rural America, and we get a few scenes to illustrate how
89260	93720	jealous Tommy is of Jim, typically through the framing of whether or not what happened
93720	97120	is fair, at least through Tommy's eyes.
97120	103200	The story is written with a painful, homespun narration style, as Ben tries his best to
103200	107160	make it sound like he's channeling a genuine American rustic.
107160	108160	Here's a sample.
108160	113120	I remember a time when I was a kid that Dad gave me and Jim Christmas presents.
113120	116840	He gave Jim a wristwatch and he gave me a hunting knife.
116840	119040	Boy was Jim taken with that wristwatch.
119040	124920	He'd wear it around every day, rain or shine, always careful to keep it clean, to keep it
124920	125920	wound.
125920	130520	If he scuffed it up, he'd buff that scuff right out, and he'd spend hours with a
130520	136640	handkerchief spitting on it and rubbing it, spitting on it and wiping it until it looked
136640	137640	brand new.
137640	141680	Now if that sounds like it would be annoying to read, you would be right.
141680	145000	In this story, Tommy is jealous of Jim's wristwatch.
145000	148760	And even though he tries to make the best of it by going hunting with his knife, Tommy
148760	150880	eventually loses it in a creak.
150880	153040	A detail to remember.
153040	157920	Next we flash forward in time and Tommy is a senior in high school and Jim is at a nonspecific
157920	161680	college that's only ever referred to as State.
161680	167120	Tommy has just met Emily, shortened to M. As the star fullback on his school's football
167120	172400	team, Tommy has his pick of girls, but he's settled on M, the head cheerleader.
172400	176400	He's not only sweet on her, he's convinced M is his future wife.
176400	181240	If you're rolling your eyes right now thinking this is some 1950s cliche, you'd be surprised
181240	185720	to know that this story takes place in the 90s, or at least the 90s at the very earliest
185720	190720	since Tommy refers to M as a miniature Britney Spears.
190720	194720	I'm not sure why she's miniature since a high school senior is nearly a full grown
194720	195720	adult.
195720	200480	With his parents out of town, Tommy brings M back to his place so they can hook up.
200480	205120	Instead he finds Jim has come home for the weekend from State.
205120	207520	Then we get this exchange.
207520	209600	And that's when Jim opened the door.
209600	214120	He was back from State where he was studying agriculture engineering and he looked at me
214120	218520	laughing with his eyes and said, hey brother, I'm home.
218520	221920	When I turned back to introduce M, she was looking at him.
221920	224080	They were married six months later.
224080	225920	That must have been one hell of a look.
225920	229640	And that's quite a jump for two sentences in the same paragraph.
229640	232080	We never really find out why M isn't a Jim though.
232080	233080	She just is.
233080	239080	In the next paragraph, Tommy and Jim's father dies and their mother sinks into a deep depression.
239080	243480	The farm falls into peril and Jim and M move back home to take care of things.
243480	247640	Soon afterwards, their mother tries to drown herself in the bathtub, but survives the
247640	249880	attempt and is left with brain damage.
249880	251880	And this all sounds like it's moving too quickly.
251880	255240	I've literally just covered two paragraphs of this story.
255240	258160	Its pace is manic.
258160	261640	And if you're wondering if there are any more details on the mother character, let
261640	262800	me stop you right there.
262800	266800	We don't learn a thing about who this woman is or why she does what she does.
266800	270200	She's literally just a perpetual burden on her family.
270200	271720	And she doesn't even get a name.
271720	276920	Tommy was going to be a football player at State, but he hurts his knee, losing his scholarship,
276920	278360	and he's forced to drop out.
278360	283280	And now the family is just stagnating at the farm when Jim gets this big idea.
283280	287080	He's thought of a special plow that will make the millionaires.
287080	291720	While he begins tinkering with that machine for weeks on end, all the work lends on M
291720	297000	and Tommy, who putter along muttering annoyances about the absent-minded Jim.
297000	299560	Eventually their mother starts a fire in her room.
299560	303920	Tommy and M race to help her while Jim is too busy with his machine to notice.
303920	307560	Just barely, Tommy and M are able to save Mother.
307560	312480	Tommy, obviously upset with his brother who did not notice their mother nearly burning
312480	318320	to death in her room, decides to confront Jim in a tense scene in the barn.
318320	321160	Sure enough, Jim was under that plow again.
321160	323640	I stood there for a minute, then two.
323640	327440	It must have taken the bastard five solid minutes to notice me.
327440	333040	When he did, he got out from under the plow, stood up, gave a kind of little smile, and
333040	335000	asked what was wrong.
335000	337720	And I knocked him flat on his ass.
337720	343480	Listen, Jim, I said to him, you've been having it your own way all this time, but some things
343480	345040	are gonna change.
345040	348800	You've been king of this place for our whole life, but I've had enough of it.
348800	351040	I want my peace.
351040	353160	There's so much to say about this exchange.
353160	354680	Tommy is so pissed.
354680	359800	He storms into the barn and then stands there for five minutes?
359800	362000	That doesn't seem particularly mad.
362000	366040	And then, instead of confronting Jim about his negligence nearly getting their mother
366040	370400	killed, he instead starts talking about wanting his peace.
370400	372840	Tommy never mentions his mother in this scene.
372840	378000	He just whines about things and being unfair, with Jim getting all the breaks.
378000	381840	Jim responds by turning into a character from an Ayn Rand novel.
381840	386120	Tommy, he said, you don't do anything of importance around here.
386120	388200	You think I need you to run this place?
388200	391320	I could hire a field hen for one quarter the price.
391320	393800	I'm doing it out of charity for you.
393800	395560	You've never held down a real job.
395560	399440	You're still going on and on about your days back in high school.
399440	400840	Nobody cares anymore.
400840	402340	I produce.
402340	404920	The spark in his eyes was beginning to return.
404920	407600	I knew this meant he was especially mad.
407600	408960	You aren't worth anything.
408960	410320	You've got no education.
410320	411880	You've got no prospects.
411880	414440	You know what dad told me before I left to school?
414440	416120	He said, look after Tommy.
416120	420280	If anything happens, Jimmy, he can't take care of himself.
420280	422320	Just what do you think I've been doing?
422320	426360	I started to talk, but he gave me a look that said I'd better shut my mouth.
426360	427640	He kept going.
427640	430400	You know what I've been doing in this barn all this time?
430400	434520	Trying to make something for myself and for Am, sure, but mostly I've been trying to
434520	436320	take care of you.
436320	440440	Still, even though you're sullen and you're lazy and you're ungrateful and you think
440440	445720	somehow I've cheated you, even though I spent years helping you with your homework, teaching
445720	450160	you the rules of football, hell, I even got that man from state to come see you play.
450640	454720	When this thing makes us a million bucks, I'm planning on sending you back to college
454720	456800	so you can make something of yourself.
456800	461120	But if you want to leave, you pick up and you get the hell out.
461120	463760	This diatribe reframes the entire story for us.
463760	469600	Now we see Tommy as the big dumb idiot and Jim as the smart, intelligent brother who's
469600	471600	just trying to help everyone out.
471600	473720	Tommy is just too dumb to see it.
473720	478400	Jim's kind offer to take care of his brother is supposed to make him look magnanimous.
478400	481600	Even after he basically told him he's a useless idiot.
481600	486480	Since Jim is a producer, we're supposed to think it's okay that he treats his brother
486480	488120	with such disdain.
488120	490880	And maybe Tommy is a loser.
490880	496400	Maybe his choice of focusing on athletics over academics and then him ending up getting
496400	501640	injured blew his entire future and the guy lost his high school crush to his brother.
501640	506200	Tommy has had a rough time of it and maybe he needs a reality check to snap him out of
506200	510200	this funk and get him to take responsibility for himself.
510200	513240	But you know what that speech doesn't excuse?
513240	516120	Letting your mother die in a fire.
516120	518640	That's how this critical speech completely fails.
518640	523520	If we're supposed to take Jim's side here, it would be a lot easier if he, the supposedly
523520	528760	responsible brother, hadn't nearly let his mother die in a fire.
528760	532960	Also Jim technically hasn't done all that much yet.
532960	537760	Tommy and Em run the farm and they're supposed to just assume Jim will invent their way into
537760	538760	a fortune.
538760	541720	The story gives us no reason to believe this will happen.
541720	545960	And if anything, Jim comes off as unbearably smug in this monologue.
545960	549680	So naturally, Ben has decided he's the good guy in this story.
549680	554320	After this, we move on to a scene where Tommy runs into Em late at night, finding her sobbing
554320	558840	about her miserable life as a farm wife taking care of a sick old woman.
558840	562560	Tommy figures this is a great time to talk about hooking up again.
562560	564160	Naturally, it doesn't work.
564160	569240	Embarrassed at his lack of game, Tommy runs into the woods and while passing by the creek,
569240	572560	he finds his old knife, sparkling like new.
572560	578000	I'm not sure how this knife is still in such good shape and hasn't moved in the last 15
578000	582440	years, but such is the magic of forced storytelling.
582440	586600	A few days later, Jim calls Tommy into the barn to tell him his new plow has finally
586600	587600	been finished.
587600	591440	He brings Tommy into the barn to take a look and to talk about how their lives are about
591440	595560	to take a turn for the better and then this predictable twist happens.
595560	597960	This is Tommy talking to Jim.
597960	601000	He hopped over to me like a jackrabbit and grabbed me by the arms.
601000	604360	Kiddo, we're all set from here to the flood.
604360	608240	You're a junior partner in the firm and we're headed right to the top.
608240	609720	His smile was infectious.
609720	612360	I could feel myself smiling too.
612360	614940	And then the knife was up under his ribs.
614940	617480	He looked so confused for a minute.
617480	619680	I was confused too.
619680	621120	I can explain it to you, Tommy.
621120	626200	It turns out you were in a very forced and contrived retelling of the Cain and Abel story.
626200	628080	One jealous brother murders the other.
628080	632440	Unlike Cain, though, Tommy gets away with the crime by pretending the plow is what killed
632440	633440	his brother.
633440	635800	Or at least, he seems to get away with the crime.
635800	640080	In the next scene, Tommy tries to sell the plow to make those millions, but he can't
640080	641500	get it to work.
641500	645800	Turns out there's something wrong that I guess Jim can only fix.
645800	651280	So Tommy goes home with no money and a busted plow, and eventually packs up and leaves the
651280	655960	farm and Tommy is left alone taking care of his sick mother.
655960	662160	What this story is so pointedly pressing upon us is the idea that people are born with unalterable
662160	667160	traits, essential components that make them who they are which can never be changed.
667160	670080	Tommy was born dumb and Jim was born smart.
670080	674360	Their lives reflect this internal trait and they have no way of escaping this biological
674360	675360	reality.
675360	680280	What Tommy can hope for is Jim taking care of him, and all Jim needs from Tommy is for
680280	682560	Tommy to get the hell out of his way.
682560	686840	What's most strange about this story is it pretends circumstances are meaningless and
686840	691440	that even when you have a person like Tommy who is apparently cared for, he still can't
691440	693720	escape the loneliness he was born with.
693720	698760	I'll have more to say about this idea of essentialism during the third story.
698760	704760	You know, I did like the idea of an unreliable narrator whose bias is revealed when confronting
704760	706840	the characters he covets.
706840	708880	Maybe in the hands of a talented writer?
708880	710780	This could have actually been really good.
710780	714720	But here's a spoiler for the next two stories before we get into those.
714720	718440	What's fair is easily the best story in the book.
718440	723360	And with that ominous revelation, let's move on to the next one.
723360	728920	Our next stop in the Shapiroverse is the science fiction story From the Pit.
728920	734100	This is a tale of the far future where our hero, a man named Kemp, is fighting for his
734100	739380	survival against hordes of dust mites for the sake of his rich benefactor.
739380	741540	And yes, I did say dust mites.
741540	747400	In this vision of the future, a wealthy man, only referred to as the whale, hires thousands
747400	751940	of people to be shrunk down to less than a millimeter, which is about four hundredths
751940	755140	of an inch, so they can shoot dust mites in the face.
755140	759260	Now before we continue with the plot, I need to acknowledge that this is maybe the dumbest
759260	761980	plan to eliminate dust mites I've ever heard.
761980	766180	Why not, say, make the humans big enough that the dust mites can't harm them and
766180	768100	just spray them like roaches?
768100	772400	Why not skip shrinking humans entirely and use chemicals from the get-go?
772400	775500	Why not just write a story that doesn't have such a bad premise?
775500	779820	Of all the stories in this collection, this one is in the most desperate need of some
779820	780820	copy editing.
780820	783300	Here's an actual sentence from the story.
783300	784800	Two years.
784800	788260	That was the length of that damnable contract.
788260	790780	I though the money would enough.
790780	792460	Did no one read this over?
792460	795460	I though the money would enough.
795460	801280	And the rest of the paragraph reads, a guaranteed pension for life, an endless income, a nice
801280	807340	house above the bay with the wind blowing off the sea, Amy in my arms.
807340	809940	She warned me against this.
809940	811540	She was right.
811540	814300	I was wrong.
814300	818340	Sentences either run on for way too long or they're too short and snippy.
818340	823080	It doesn't use commas properly and I though the money would enough.
823080	826900	And don't worry, that's not even the worst grammatical flub in this story.
826900	828660	But back to the plot.
828660	833020	Kemp pines for Amy, an absent love interest that reminds us he has something to live for
833020	836140	in light of the horrors that come.
836140	840620	Kemp fights a bunch of dust mites in a confusing battle scene where he's hanging off the side
840620	846460	of a cigarette when the whale, a clean freak who is also a compulsive smoker, decides to
846460	848740	light up the cigarette and take a drag.
848740	853380	In the chaos, Kemp falls into the whale's mouth and thanks to his little protective
853380	858860	bubble called a halo, he manages to affix himself to the side of the whale's stomach.
858860	863940	A man trapped in the belly of a whale is an obvious reference to the story of Jonah and
863940	866380	the whale from the Old Testament.
866380	871180	In that story, after Jonah turned his back on his mission as a prophet, God had him swallowed
871180	874100	up for a few days by a giant fish.
874100	877100	Jonah eventually is thrown up and then becomes a prophet.
877100	881440	In this story, Kemp is learning the error of wanting to make money from a rich guy who
881440	884500	has a really weird method of killing dust mites.
884500	886760	So not exactly the same.
886760	889040	Or similar.
889040	892980	While sitting in the stomach, Kemp sees the awful truth about the whale.
892980	894440	He has a tumor.
894440	898540	And an ulcer, which is something I'm just mentioning because it'll be used as a plot
898540	900140	device later on.
900140	903060	Somehow Kemp knows the tumor is really bad.
903060	905900	So bad that the whale will be dead in a couple of months.
905900	910400	We haven't gotten any information that Kemp has any sort of medical training or knowledge.
910400	913060	This is just something he knows.
913060	917220	This knowledge about the tumor could make Kemp fabulously wealthy.
917220	920500	And that does make sense knowing that some big important business dude is going to be
920500	924100	dead in a couple of months is prime blackmail material.
924100	928020	Kemp though isn't a bastard and doesn't want to take advantage of this situation.
928020	932700	Kemp radios his buddy Jensen, letting him know he's trapped in the stomach and that
932700	934580	he's seen the whale's tumor.
934580	937700	He promises not to say a word about it to anyone.
937700	942500	Jensen tries speaking to the whale, but he doesn't believe Kemp and decides he's just
942500	943980	going to kill him.
943980	949220	It's at this point in the story where we get a truly mystifying line that, I suspect, is
949220	951260	the subtext for this entire story.
951260	955600	I'm going to be a bit of a jerk though and not reveal it until we get to the very end.
955600	961320	As we move along, try and guess what this story is secretly an allegory for.
961320	966040	The whale calls a doctor to have Kemp killed, and their plan is to send in robotic dust
966040	968400	mites to hunt him down.
968400	973200	These were going to eventually replace shrinking humans down to fight dust mites, and I don't
973200	977780	know why they just didn't start with the robots, but this is the story we have.
977780	981480	Inside the stomach, Kemp has decided he's just going to let himself grow back to full
981480	984040	size and rip his way out of the whale.
984040	987960	And to do that, he's going to have to fight his way through the robotic dust mites.
987960	994080	Reversion to his normal size is a gradual process for Kemp, so at this point, he's
994080	999520	about twice his starting size, so probably one tenth of an inch, assuming he started
999520	1002440	off as slightly larger than a dust mite.
1002440	1007520	As the dust mites tear open the halo protecting Kemp, he comes out fighting, kicking his way
1007520	1009960	past them and climbing up the stomach lining.
1010040	1015600	Of course, since his tiny little clothes have all ripped off, he's doing it naked, burning
1015600	1017680	his hands and feet on the stomach lining.
1017680	1023120	As he climbs into the esophagus, one of the dust mites bites off Kemp's leg.
1023120	1025760	Then we get this doozy of a typo.
1025760	1030680	For context, Kemp is pulling himself into the esophagus, which looks like a constricting
1030680	1032520	ring from his perspective.
1032520	1039160	Finally, I pry the damn thing open, pull myself halfway through, and it closes around
1039160	1040160	my waist.
1040160	1044280	I'm trapped, the clicking sounds of the mites closer and closer.
1044280	1049000	I'm sorry, it closes around your… what?
1049000	1050480	Your waist?
1050480	1057760	Is Kemp in the process of relieving his bowels here, or did someone just not know how to
1057760	1058760	spell waist?
1059320	1063120	Of course, I'm sure Ben knows how to spell waist properly.
1063120	1066880	This just speaks to the importance of copy editors and how they're your friends, and
1066880	1071120	if you employ one and have them look over your work, they'll keep it from looking
1071120	1073120	like waist.
1073120	1078640	Somehow Kemp pulls himself to safety and uses what's left of the stomach acid to cauterize
1078640	1079880	the wound.
1079880	1085640	Of course, acid liquefies flesh, making it a horrible fluid to cauterize anything.
1085640	1091200	Missing a leg and sitting in the esophagus, Kemp decides he'll have a little nap.
1091200	1095200	And by little nap, I mean really long sleep.
1095200	1096200	September 23rd.
1096200	1099400	I've lost all sense of time.
1099400	1105760	I can tell by my size, I'm now about 3 inches tall, that it's been another 36 hours.
1105760	1110960	How can you lose all sense of time and then be able to tell it's been 36 hours?
1110960	1116440	And how on earth did the whale go 36 hours without eating any food that would have surely
1116440	1118040	dislodged Kemp?
1118040	1126400	And how did he sleep, I guess standing up, in the esophagus, missing a leg for 36 hours?
1126400	1130960	It's at this point Kemp revises his plan, instead opting to climb out of the esophagus
1130960	1134120	instead of just bursting through the whale's guts.
1134120	1139400	And we get this funny little scene where Kemp punches the whale from inside of his throat.
1139400	1143840	It's stupid and random, but it's the only part of the story I liked, it's just this
1143840	1147520	adorably pathetic little gesture of a tiny man.
1147520	1153200	The whale gets desperate and the doctor pulls out their trump card, some Ipecac, which will
1153200	1154520	induce vomiting.
1154520	1158520	By vomiting up that stomach acid, it would burn Kemp to death.
1158520	1163200	Kemp thinks quickly and decides to go back into the stomach, this time with a plan.
1163200	1166640	He heads towards the ulcer, remember that thing from a little earlier?
1166640	1171240	He starts tearing at it, getting it to start bleeding, and for some reason this attracts
1171240	1172800	all the robotic dust mites.
1172800	1177880	I don't know how Kemp knew this would happen, or why it happens at all, but it does.
1177880	1181480	Here's a fun fact, dust mites don't drink blood.
1181480	1186040	Maybe the robotic ones are different, but I'm not sure why anyone would program them
1186040	1191360	to drink human blood, that seems like a weird thing to program a robot to do.
1191360	1193600	But now let's think about this plan for a moment.
1193600	1198120	When it begins, the doctor has already given the whale the Ipecac, and according to Kemp,
1198120	1201080	he has seconds to pull all of this off.
1201080	1206400	Just a few seconds now before the geyser of acidic vomit comes up, finishing me.
1206400	1211240	I rub my right leg, what's left of it, and look down through the ring.
1211240	1216600	Ipecac is washing through the stomach, and mechanical mites are swimming around in it.
1216600	1223000	Soon they'll be joining me, along with the acid, unless I join the bursts.
1223000	1227040	The ulcer, it's the only chance.
1227040	1230840	Kemp somehow knew to use the robotic dust mites to attack the ulcer.
1230840	1236020	He somehow knew the doctor would then, on the spot, decide to cut open the whale to
1236020	1240600	get it out, and in that whole mess, Kemp would jump to freedom.
1240600	1244740	And that's the genius plan that Kemp just came up with on the spot.
1244740	1250560	And what about that impending vomit after the whale swallows the Ipecac?
1250560	1256360	I think Ben just kind of forgot about it, because it's never mentioned.
1256360	1260040	Kemp was in the stomach the whole time, so it would have killed him.
1260040	1263560	The impending vomit acid just never arrives.
1263560	1269560	Also, it's really impressive that Kemp pulls off this entire plan with one leg.
1269560	1272320	That's one heck of a plan coming together.
1272320	1276440	The story ends with the whale demanding that the doctor kill Kemp, but Jensen decides to
1276440	1278960	murder the doctor instead to save his friend.
1278960	1284040	The whale, who at no point vomits in this story, presumably bleeds out because he has
1284040	1286800	a giant hole in his stomach.
1286800	1290720	So with the story now told, have you figured out the subtext?
1290720	1295720	It's really tough, because even when you know and you can see the connections more clearly,
1295720	1297440	it still doesn't make any sense.
