start	end	text
1485000	1493000	And I think that's what this book illustrates best. The idea of holding the text as sacred and unchangeable is the antithesis of what makes art interesting.
1493000	1502000	And when we submit our lives to not questioning what we've been told as sacred, we create boring books that retell the same gospel stories we've heard countless times over.
1502000	1515000	We all become Agios on an endless mission to deliver trinkets to children, never considering that this gift of immortality might be used to make the world a better place in some other way than the one God has told us is the right path.
1515000	1518000	And that's why I didn't like this book.
1518000	1535000	Ordinarily, I would include some commentary about the lasting impact of this book, but this is one of the lesser known novels of Glenn Beck. Based on the number of ratings it has on Goodreads, it's not as popular as The Christmas Sweater, Agenda 21, or The Overton Window.
1535000	1551000	Based on the trailer and comments from Glenn Beck himself, he was hoping to turn this novel into a movie, and that clearly did not happen. I couldn't find sales figures for this book, but having only been released as a small hardcover, I suspect they weren't very impressive.
1552000	1567000	This was a shorter book review than usual because there isn't a whole lot to say. I'm kind of experimenting with my form here, fusing summary and analysis together. Let me know if you like it that way, if you'd rather have just a plain summary and then analysis, like clearly separated or more mixing.
1567000	1579000	I don't know. This book kind of sucked and was boring, and I wish I had chosen something better, but the madness of the idea seduced me. I ignored all the reviews saying this was a boring book, and yeah, right into it.
1579000	1593000	Also, I'm talking a little longer here in the credits because you might notice I have a new song in the background that my lovely friend Dana recorded. Also, I'm announcing that I'm doing YouTube memberships now. If you are currently a patron, don't bother becoming a member because it is the exact same thing.
1593000	1608000	You can express your thanks for me on the lowest tier of the membership, but if you go up to the $4.99 tier, which is the exact same price as Patreon, minus one cent because YouTube won't let me put $5, you will get your name in the credits like these lovely people. Early access to videos and a download.
1608000	1622000	And a download to Dana's classic theme for me and this new one, which is pretty cool. I even include a short version of the original theme because why not? That money helps me create more videos like this one or my sitcom retrospectives or like my response videos.
1622000	1637000	And I appreciate it very much. If you'd like to support this channel in a way that doesn't cost you any money, though, that's always available because you can like, comment and subscribe or hit the bell if you haven't already. Thank you so much for watching.
1638000	1641000	With Jose.
